Name,URL,Photo,Description,Members
The Atlanta JavaScript Meetup Group,https://www.meetup.com/AtlantaJavaScript/,https://secure.meetupstatic.com/photos/event/2/7/8/b/600_451330123.jpeg,"Meet other local JavaScripters to share knowledge, to review the state of the art, or to dream up new applications.",4661
Freeside Atlanta,https://www.meetup.com/Freeside-Atlanta/,https://secure.meetupstatic.com/photos/event/2/5/a/4/600_451929636.jpeg,"Freeside is a Makerspace for hackers, designers, artists, students, and hobbyists in Atlanta, Georgia. We host lots of classes and projects to help people network and make their ideas a reality.

We are a non-profit organization with a space that features a classroom, 3D printers, an electronics lab, co-working space, a media lab, a workshop, and and two auto bays. Members and non-members can make use of the space for art, projects, and education.

Our projects include CNC, 3D Printing, Art, Robotics and UAVs, electronics, woodworking, biology, chemistry, and much more!

Links

Wiki: wiki.freesideatlanta.org (http://wiki.freesideatlanta.org/)

Blog: blog.freesideatlanta.org (http://blog.freesideatlanta.org/)

Mailing List: Freeside Atlanta (http://groups.google.com/forum/?fromgroups#!forum/freesideatlanta)

Our Space

We have 6,000 square feet of versatile space in the Metropolitan Warehouses.
You can have a look at our space on our Wiki (https://wiki.freesideatlanta.org/fs/Our_Space).",4633
PyAtl: Atlanta Python Programmers,https://www.meetup.com/python-atlanta/,https://secure.meetupstatic.com/photos/event/7/8/2/3/600_449910755.jpeg,"PyAtl meets every month in Atlanta for presentations and discussion about Python, the powerful and easy-to-use programming language. Every meeting tries to include something for beginners, and also to tackle advanced topics for seasoned developers. We are all learning, so don't be shy about attending, no matter your experience level! Come discover the feeling of community that emerges when people step forward from behind their blogs and keyboards to talk about their favorite programming language.

Participation is free, unless otherwise noted for special events.

If you're looking for Python programmers, we want to help! Please see our Consultants list (http://www.meetup.com/python-atlanta/pages/Consultants/) and Recruiter and Job Listing policy (http://www.meetup.com/python-atlanta/pages/Recruiter_and_Job_Listing_Policy/) for details.",4223
Atlanta Startup Founder 101,https://www.meetup.com/Atlanta-Startup-Founder-101/,https://secure.meetupstatic.com/photos/event/5/7/0/1/600_445102273.jpeg,"At Startup Founder 101, aspiring and early-stage startup founders meet once a month to hear candid talks by successful local entrepreneurs. Learn the best practices, strategies, and mistakes to avoid from those who have been there, done that. Then, if you’d like, you can share your ideas and plans in a relaxed setting to get personal and professional feedback.

The next Meetup will be announced shortly - join our group to get updated!",4047
Atlanta Web Design Group,https://www.meetup.com/atlantawebdesign/,https://secure.meetupstatic.com/photos/event/a/d/4/600_331022772.jpeg,"We aim to provide a place for Web professionals to meet new people, exchange ideas, learn new things, and have a little fun. We have several events each month: one for learning, and happy hours all over the metro area for socializing.

The group features some of the best talent in the Web industry from all over the country. You are sure to leave each event with something that you can apply in your daily work. It is a great place to learn from your peers and colleagues, build new relationships, and grow within the local web community.

Check out the schedule for more info and be sure to join us at the next Meetup. We look forward to meeting you.",3758
Data Science & Business Intelligence Society of Atlanta,https://www.meetup.com/Atlanta-Society-for-Business-Intelligence/,https://secure.meetupstatic.com/photos/event/a/6/0/6/600_442842502.jpeg,"The Data Science and Business Intelligence Society of Atlanta is a vendor-neutral organization created for the purpose of sharing knowledge and experiences relative to data science and business intelligence, exploratory and predictive analytics.

Find us on LinkedIn: www.linkedin.com/groups/Business-Intelligence-Society-Atlanta-6639804",3657
Atlanta Big Data User Group,https://www.meetup.com/BigData-Atlanta/,https://secure.meetupstatic.com/photos/event/e/4/5/4/600_271918452.jpeg,"The Atlanta Big Data Meetup group is an Atlanta based community of technology professionals dedicated to promoting the solutions, best practices, and innovative ideas needed for enterprise organizations to get the maximum value from the data their organizations are collecting every day. With over 2.5 quintillion bytes of data are created every day, we are at the epicenter of a ""data"" revolution. Through an exchange of BIG ideas, education, and fresh thinking from data professional, technologists, and enthusiasts, Atlanta Big Data aims to focus on providing interesting insights into issues related to data visualization, data in motion, data at rest, batch processing, and cover leading edge architectures, and solutions related to the Big Data to include security, privacy, analytics, and support from development to operations. The intent of Atlanta Big Data isn’t solely technical, the Group strives to discuss, discover, and communicate how Big Data solutions can be used to advance and support national security, energy, transportation, media, logistics, financial services, law enforcement, healthcare, and education and many other areas that serve our community’s interests.",3620
North Atlanta JavaScript and Web Dev,https://www.meetup.com/NorthAtlantaJavaScript/,https://secure.meetupstatic.com/photos/event/1/3/e/600_433980318.jpeg,"Welcome to the North Atlanta JavaScript User Group
We'll have presentations and hands-on labs on JavaScript and all things web dev!",3595
SEO & Wordpress,https://www.meetup.com/atlanta-wordpress-seo/,https://secure.meetupstatic.com/photos/event/2/d/d/e/600_427451742.jpeg,"SEO & Wordpress meetup (http://www.meetup.com/atlanta-wordpress-seo) group is designed to help small business owners to be found online.

Please check our group reviews.

If you are starting a business or need help promoting an existing business, this is the meetup to be in.

By attending our meetup, you will learn the following:

➤ Search Engine Optimization (SEO)

➤ Create/Edit and publish a Wordpress site

➤ Wordpress Plugins, Themes and Widgets

➤ Website tweaks and best practices

➤ Small Business Web Tools

➤ Google Services, Adwords, Adsense & Google Places

➤ Online Marketing

This information is sourced from first hand experience from a current WordPress designer and business owner.

Please join us (http://www.meetup.com/atlanta-wordpress-seo/join/), I promise you'll learn something new and come back for more!

Thank you, I look forward to meeting you soon.

Tony Rached

This meetup Sponsored by:

Diminished Value of Georgia (http://www.diminishedvalueofgeorgia.com)",3434
The Iron Yard - Atlanta,https://www.meetup.com/The-Iron-Yard-Atlanta/,https://secure.meetupstatic.com/photos/event/9/9/8/c/600_446859308.jpeg,"The Iron Yard exists to create exceptional growth and mentorship for people and their ideas through tech-focused education. We’re passionate about the communities we exist in and strive to be good citizens of the tech industry. Our doors are open to everyone who wants to learn about technology, from kids to people who want to change careers. Come to one of our events to see what all of the excitement is about.",3330
Atlanta Web Technology Group,https://www.meetup.com/AtlantaWTG/,https://secure.meetupstatic.com/photos/event/6/d/1/1/600_25587921.jpeg,"We are a 501(c)(3) non-profit organization that is dedicated to the education and discussion of web and mobile technologies. We are the oldest continuous running technology user group in Atlanta, and membership is completely FREE.",3279
Atlanta Tech & Entertainment - Workshops & Competitions,https://www.meetup.com/ATT-Atlanta-Tech-Entertainment/,https://secure.meetupstatic.com/photos/event/b/0/2/b/600_460425099.jpeg,"High quality, free technology and entertainment workshops and competitions by AT&T

AT&T only holds a few technology and entertainment-oriented workshops and competitions each year in your area, so you won't get a lot of messages from us. But join this meetup and when we do you'll be the first to know when we’re coming to XX!

In addition to the quality developer-oriented workshops and hackathons we are already known for we are adding workshops and competitions on filmmaking, virtual reality, and other entertainment-oriented subjects.

We look forward to seeing you!",3279
Data Science ATL,https://www.meetup.com/Data-Science-ATL/,https://secure.meetupstatic.com/photos/event/1/e/5/c/600_337567772.jpeg,"A gathering of current and aspiring Data Science practitioners. We focus on practical applications of exploratory data analysis, statistics, machine learning and data visualization to solve interesting problems in any field.

Interested Speakers and Sponsors - please use this form: Speaker / Sponsor Form (https://goo.gl/forms/TzQRKfOkZsDujCyw2)

Videos from previous events: http://vimeo.com/dsatl or https://www.recallact.com/dsatl

Also, donate to Data Science ATL with bitcoin using the QR code in our logo!",3235
The Atlanta iOS Developers,https://www.meetup.com/iosatlanta/,https://secure.meetupstatic.com/photos/event/9/d/0/0/600_452980192.jpeg,"This group is dedicated to people developing native applications for the Apple iPhone, iPad, iPod Touch or any iOS device (including Mac apps).

Membership is free. If you would like to give back, please consider presenting on something you are passionate about it interested in. As a business who values this community, we'd love to have your support as well. Time and people are more valuable than money so be creative

Please see our meeting events for more information as to what, when and where.

If you live or work in the North Atlanta suburbs, check out the North Atlanta iOS Developers Group (http://www.meetup.com/Greater-Atlanta-iOS-Developers-Group/) but please join our community, as well, and stay abreast of the events, discussions, community and technology happening in-town.

We're glad your here. Don't just ride the wave, make a splash.

Email list policy:

Jobs: To post gigs, jobs or availability, please use our Google Group: https://groups.google.com/d/forum/atlanta-ios-gigs (atlanta-ios-gigs@googlegroups.com)

The message board / mailing list on meet up is strictly for advice and discussion about developing apps. Any aspect of app development, including business topics, is fair game. Recruiting for or seeking opportunities is definitely part of our goal as a developer group but we have to be careful not to let that interfere with other valuable interactions. Therefore, job posts to the technical mailing list will be deleted and may result in being banned. We would rather not ban you, so don't do it :)",3229
Atlanta WordPress Users Group,https://www.meetup.com/wordpress-atlanta/,https://secure.meetupstatic.com/photos/event/4/e/5/5/600_447200053.jpeg,"This group is the oldest and largest Atlanta WordPress Meetup.

It is usually held 7:00pm, once a month at The Gathering Spot. Check the calendar for details.

We have one or two presentations depending on the degree of complexity of the topic. The presentations are designed for beginners and/or intermediates to learn to build, customize,and maintain WordPress websites.

We will also cover plugins as well as how to address business uses such as e-commerce, membership sites and supporting multiple languages. Bring your questions about your WordPress project.

We include time for refreshments, networking and trouble shooting.",3089
Atlanta Mobile Developers Group,https://www.meetup.com/Atlanta-Mobile-Developers-Group/,"",The Atlanta Mobile Developers Group is a group of individuals that are involved with or interested in the area mobile development & technology.,2984
The Online ColdFusion Meetup,https://www.meetup.com/coldfusionmeetup/,https://secure.meetupstatic.com/photos/event/7/8/9/3/600_210867.jpeg,"The Online ColdFusion Meetup, hosted since early 2007 by Charlie Arehart, has held 250 presentations by several dozen speakers on CF-related topics (and non-CF topics that may be of interest to CFers). CF users from anywhere are free to attend. Become a member here (free, joining 2,700+ others) to get notified of new meetings, optionally participate in ratings and discussions, and more.

The ColdFusion Meetup is an online ColdFusion/CFML user group which meets irregularly, as speakers can be arranged, generally at time slots on a Thursday of either noon or 6pm US Eastern time. See below for info on any scheduled upcoming talks.

All meetings are held at the URL, https://experts.adobeconnect.com/cfmeetup . Use the option there to ""log in as guest"", enter your name, and wait until just before the meeting starts to be let in.

Meetings are recorded and the URLs are posted (usually within a day of the meeting) at http://recordings.coldfusionmeetup.com . You can also see a list all our past meetings here: http://www.meetup.com/coldfusionmeetup/events/past/ .

Finally, for still more information, see the ""about page"" (http://www.meetup.com/coldfusionmeetup/about/) for things like speaking on the meetup, other ways to get meeting notifications, and more.",2785
Atlanta Scrum Users Group,https://www.meetup.com/agile-38/,https://secure.meetupstatic.com/photos/event/c/1/8/6/600_337969542.jpeg,"Meet local professionals interested in Agile/Scrum methods of software development.

Follow us on twitter: @scrumatlanta",2739
Women Who Code Atlanta,https://www.meetup.com/Women-Who-Code-Atlanta/,https://secure.meetupstatic.com/photos/event/a/7/e/9/600_451362985.jpeg,"Follow us! @WWCAtl (http://twitter.com/wwcatl) #wwcode FB: Women Who Code (http://fb.com/womenwhocode)

womenwhocode.com/atl

Mission:

Women Who Code is a global nonprofit organization dedicated to inspiring women to excel in technology careers by creating a global, connected community of women in technology. The organization tripled in 2013 and has grown to be one of the largest communities of women engineers in the world.

Empowerment:

Women Who code is a professional community for women in tech. We provide an avenue for women to pursue a career in technology, help them gain new skills and hone existing skills for professional advancement, and foster environments where networking and mentorship are valued.

Key Initiatives:

Free technical study groups

Events featuring influential tech industry experts and investors

Hack events

Career and leadership development

Current and aspiring coders are welcome.

Bring your laptop and a friend!

Support Women Who Code:

Donating to Women Who Code (http://womenwhocode.com/donate), Inc. (#46-4218859) directly impacts our ability to efficiently run this growing organization, helps us produce new programs that will increase our reach, and enables us to expand into new cities around the world ensuring that women and girls everywhere have the opportunity to pursue a career in technology.

Women Who Code (WWCode) is dedicated to providing an empowering experience for everyone who participates in or supports our community, regardless of gender, gender identity and expression, sexual orientation, ability, physical appearance, body size, race, ethnicity, age, religion, or socioeconomic status. Because we value the safety and security of our members and strive to have an inclusive community, we do not tolerate harassment of members or event participants in any form. Our Code of Conduct (https://github.com/WomenWhoCode/guidelines-resources/blob/master/code_of_conduct.md) applies to all events run by Women Who Code, Inc. If you would like to report an incident or contact our leadership team, please submit an incident report form (https://docs.google.com/forms/d/1NuBY_E2DcuJx2wtKFXyS5ZY5zZlql4jcZJqsf0sAs-0/viewform).

WomenWhoCode.com (http://womenwhocode.com/)

email: atlanta@womenwhocode.ocm (atlanta@womenwhocode.com)

Join our slack group (https://wwcatl.typeform.com/to/WKy2an) to connect with members!

Twitter (http://twitter.com/womenwhocode) | Facebook (https://www.facebook.com/WWCATL/) | Instagram (https://www.instagram.com/wwc_atl/) | Newsletter (http://womenwhocode.us13.list-manage1.com/subscribe?u=291547022100dd62571bd36db&id=aca4b91da8) | Blog (http://womenwhocode.com/blog)",2608
Learn to Code | Thinkful Atlanta,https://www.meetup.com/Atlanta-Tech-Talent-Pipeline/,https://secure.meetupstatic.com/photos/event/e/2/e/9/600_462358089.jpeg,"Want to learn to code but don’t know where to start? This meetup was created to help people in Atlanta learn to code and gain new skills in web development and data science. Join us weekdays at 6:30pm for free workshops, info sessions, tech talks, and happy hours focused on building new skills and growing your career. Our events are well-suited for both beginners learning to code as well as intermediate developers or data scientists looking to level-up. We're proud to be sponsored by Thinkful Atlanta (https://www.thinkful.com/bootcamp/atlanta/?aff=meetup), the #1 rated coding bootcamp on CourseReport, who contributes a team of experienced mentors and career coaches to help out at events.

Workshops: hands-on, group classes teach everything from full-stack web development to intro concepts in data science. The workshops are taught by Thinkful mentors, each of whom have years of experience teaching people to code.

Tech Talks: led by experts in their field, these are meant to dive deeper into a specific topic. For example, you'll learn about how to build a great portfolio, how to break into the Atlanta tech scene, and how market yourself.

Happy Hours: is there better way to talk about all things Atlanta tech than over drinks and snacks? Come joins at one of our Atlanta locations to network, learn, and most importantly have fun.

Info sessions: If you’re interested in learning more about Thinkful’s specific courses, these are the events for you! You’ll learn more about the mentorship program, career services, curriculum, and how job placement works.

For anyone looking to become a web developer or data scientist, check out Thinkful Atlanta's Flexible Web Development (https://www.thinkful.com/bootcamp/web-development/flexible/?aff=meetup), Full time Web Development Bootcamp (https://www.thinkful.com/bootcamp/web-development/full-time/), or Flexible Data Science Bootcamp (https://www.thinkful.com/bootcamp/data-science/flexible/?aff=meetup).",2579
Tech Talent South - Atlanta,https://www.meetup.com/Tech-Talent-South-Atlanta/,https://secure.meetupstatic.com/photos/event/d/9/0/1/600_445915553.jpeg,"Welcome to Tech Talent South Atlanta! Here you can find information about TTS hosted events, alumni updates, and information on how Tech Talent South is empowering folks to do BIG things!

Tech Talent South's (www.techtalentsouth.com) mission is to develop more tech talent in the South through immersive beginner-focused programs teaching web development and computer programming. We want to do our part to help put Atlanta on the map as the next big tech hub and empower creative thinkers in the area with the skills they need to drive innovation. In addition to offering kids coding camps throughout the Southeast, Tech Talent South offers 8-week Code Immersion Program for adults in the Atlanta area.

In our Code Immersion Program, we teach the following:

· Ruby on Rails

· Domain Modeling

· HTTP and ""RESTful"" Design

· HTML/CSS

· Javascript and AJAX

· How to utilize APIs

Students come out of our program with a tremendous foundation in web development and the know-how to code, design, and ship dynamic database-backed web applications. Creative thinkers and entrepreneurs are empowered with the skills to quickly develop their ideas and push them live to the web.

We are always looking for passionate, persistent, and creative people looking to do something BIG in Atlanta. If that sounds like you, check out our website to learn more.",2535
Art in Tech Atlanta,https://www.meetup.com/Art-in-Tech-Atlanta/,https://secure.meetupstatic.com/photos/event/b/3/8/6/600_458385958.jpeg,"Simply, our meetup aims to fuse the world of art and the world of tech.

This comes in a variety of forms that leverages all aspects of STEAM (Science, Technology, Engineering, Art, and Math) and creates novel connections between them. If you find yourself in any of these fields craving collaboration with like-minded (or other brained) people, this meetup is for you.

Art made with code, architecture created from musical notation, paintings by robot dogs, all this and much more can be expected to be talked about and worked on at our meetups. Because Atlanta is rapidly growing in both tech startups and artistic ventures (music and film being the most acknowledged), we are in a unique place as a city to position ourselves to be some of the most innovative in the realm of ""FutureArt"". We'll try to keep a healthy mix of discussion/sharing and workshop styled meetups, as we know this is a new field for most, and we can all benefit from each others varied experiences.",2477
IxDA Atlanta,https://www.meetup.com/ixdaatlanta/,https://secure.meetupstatic.com/photos/event/8/e/d/a/600_466176570.jpeg,"IxDA Atlanta is the local chapter of the Interaction Design Association. Since 2009, we've put on design slams, socials, film screenings, UX show & tells, and hosted local and national speakers from the professional and academic communities. If you're into user experience, design, technology, strategy, or just want to learn more, we invite you to join the conversation.

Join us on slack at http://www.ixdaatlanta.org/slack .",2471
Code for Atlanta,https://www.meetup.com/codeforatlanta/,https://secure.meetupstatic.com/photos/event/d/0/e/f/600_451613487.jpeg,"We invite technologists of all stripes -- coders, designers, data scientists, product managers, and more -- to join our all-volunteer efforts to make Atlanta a better place. Anyone can lead a civic-minded, social good project. We welcome partnerships with local non-profits and government agencies on projects that serve the public and engage with all of metro Atlanta's communities.",2460
Atlanta Ruby Meetup Group,https://www.meetup.com/atlantaruby/,https://secure.meetupstatic.com/photos/event/a/a/d/c/600_450943740.jpeg,"ATLRUG is a non-profit organization of individuals interested in developing, promoting, fostering, strengthening, and improving the Ruby programming language and Ruby community.

Meetings are held on the 2nd Wednesday of every month.

http://www.atlrug.com

To learn more about our goals and expectations for members, read our Code of Conduct (https://github.com/atlrug/CoC).",2446
Learn Code in Atlanta (Study Groups),https://www.meetup.com/Atlanta-FlatironSchool/,https://secure.meetupstatic.com/photos/event/e/9/e/b/600_448379883.jpeg,"Learn to love code with learn.co! Whether you're brand new and have no programming experience or are already pursuing a career change to software development, get some in-person support from others by attending these study groups. Remember to bring your laptop and a charger!",2412
Girl Develop It Atlanta,https://www.meetup.com/Girl-Develop-It-Atlanta/,https://secure.meetupstatic.com/photos/event/9/c/e/e/600_446500174.jpeg,"Want to learn how to code? Have a great idea? Don't be shy. Develop it.

At Girl Develop It, our goal is to empower and assist women interested in getting into and advancing in the tech industry.

Our courses will focus on teaching modern development best practices and having something to show for it (ie. a sweet website, a native mobile app, a browser based game, a network of industry experts, or even a stellar résumé).

A limited number of scholarships are available for those with a financial hardship. To apply, click here (https://docs.google.com/forms/d/1tQeFIvqNbBOtOt2mRJSVQDqOUbz7PFeMJDzq_mKTkT8/viewform?usp=send_form). Scholarship applicants will be notified shortly after the deadline. Class capacity does not impact scholarship students. Check out this info sheet (https://drive.google.com/a/girldevelopit.com/file/d/0B344HUnWO0EhOFI4SmpWVjE2Yms) about getting course fees covered by your employer.

Want to Volunteer?

We'd love to have you involved in Girl Develop It! Please fill out this brief form (http://goo.gl/forms/aFDaFYag9P).

Want to learn more about the Atlanta Chapter? Feel free to follow us (and tag us) through our social channels below:

• Blog (https://girldevelopitatlanta.wordpress.com)

• Facebook: Girl Develop It Atlanta (https://www.facebook.com/GDIAtlanta?ref=hl)

• Twitter: @GDIAtlanta (https://twitter.com/GDIAtlanta)

• Instagram (http://instagram.com/GDI_Atlanta)

• LinkedIn Group (https://www.linkedin.com/groups/8436954)

As always, thank you for supporting Girl Develop It on our mission to make software development easy, affordable and accessible to all women. Your contribution (http://girldevelopit.com/donate) helps us expand our mission to create great programs and opportunities for women learning to code.

Note: Girl Develop It welcomes all genders and identities to our classroom. By entering this group, all community members agree to abide by our Code of Conduct (https://www.girldevelopit.com/code-of-conduct).",2322
